{
  "$schema": "../docs/translation-pack.schema.json",
  "schemaVersion": 1,
  "edition": "2024",
  "source": "Traduction de l’extrait utilisateur et des passages SRD correspondants · adaptation française · CC-BY-4.0 · https://www.dndbeyond.com/srd",
  "entries": [
    {
      "id": "rage-dragon-2024.rage.start",
      "en": "You can imbue yourself with a primal power called Rage, a force that grants you extraordinary might and resilience. You can enter it as a Bonus Action if you aren’t wearing Heavy armor.",
      "fr": "Vous pouvez vous imprégner d’une puissance primale appelée Rage, qui vous confère une force et une résistance extraordinaires. Vous pouvez entrer en Rage par une action Bonus si vous ne portez pas d’armure lourde."
    },
    {
      "id": "rage-dragon-2024.rage.uses",
      "en": "You can enter your Rage the number of times shown for your Barbarian level in the Rages column of the Barbarian Features table. You regain one expended use when you finish a Short Rest, and you regain all expended uses when you finish a Long Rest.",
      "fr": "Vous pouvez entrer en Rage le nombre de fois indiqué pour votre niveau de Barbare dans la colonne Rages de la table des aptitudes du Barbare. Vous récupérez une utilisation dépensée à la fin d’un Repos court et toutes les utilisations dépensées à la fin d’un Repos long."
    },
    {
      "id": "rage-dragon-2024.rage.rules",
      "en": "While active, your Rage follows the rules below.",
      "fr": "Tant qu’elle est active, votre Rage suit les règles ci-dessous."
    },
    {
      "id": "rage-dragon-2024.rage.resistance",
      "en": "You have Resistance to Bludgeoning, Piercing, and Slashing damage.",
      "fr": "Vous bénéficiez de la Résistance aux dégâts contondants, perforants et tranchants."
    },
    {
      "id": "rage-dragon-2024.rage.damage",
      "en": "When you make an attack using Strength—with either a weapon or an Unarmed Strike—and deal damage to the target, you gain a bonus to the damage that increases as you gain levels as a Barbarian, as shown in the Rage Damage column of the Barbarian Features table.",
      "fr": "Lorsque vous effectuez une attaque utilisant la Force, avec une arme ou une Frappe à mains nues, et infligez des dégâts à la cible, vous gagnez un bonus aux dégâts qui augmente avec vos niveaux de Barbare, comme indiqué dans la colonne Dégâts de Rage de la table des aptitudes du Barbare."
    },
    {
      "id": "rage-dragon-2024.rage.advantage",
      "en": "You have Advantage on Strength checks and Strength saving throws.",
      "fr": "Vous avez l’Avantage aux tests de Force et aux jets de sauvegarde de Force."
    },
    {
      "id": "rage-dragon-2024.rage.no-spells",
      "en": "You can’t maintain Concentration, and you can’t cast spells.",
      "fr": "Vous ne pouvez ni maintenir votre Concentration ni lancer de sorts."
    },
    {
      "id": "rage-dragon-2024.rage.duration",
      "en": "The Rage lasts until the end of your next turn, and it ends early if you don Heavy armor or have the Incapacitated condition. If your Rage is still active on your next turn, you can extend the Rage for another round by doing one of the following:",
      "fr": "La Rage dure jusqu’à la fin de votre prochain tour. Elle prend fin prématurément si vous revêtez une armure lourde ou subissez l’état Neutralisé. Si elle est encore active à votre prochain tour, vous pouvez la prolonger d’un round en accomplissant l’une des actions suivantes :"
    },
    {
      "id": "rage-dragon-2024.rage.extend.attack",
      "en": "Make an attack roll against an enemy.",
      "fr": "Effectuer un jet d’attaque contre un ennemi."
    },
    {
      "id": "rage-dragon-2024.rage.extend.save",
      "en": "Force an enemy to make a saving throw.",
      "fr": "Obliger un ennemi à effectuer un jet de sauvegarde."
    },
    {
      "id": "rage-dragon-2024.rage.extend.bonus",
      "en": "Take a Bonus Action to extend your Rage.",
      "fr": "Utiliser une action Bonus pour prolonger votre Rage."
    },
    {
      "id": "rage-dragon-2024.rage.extend.end",
      "en": "Each time the Rage is extended, it lasts until the end of your next turn. You can maintain a Rage for up to 10 minutes.",
      "fr": "Chaque fois que la Rage est prolongée, elle dure jusqu’à la fin de votre prochain tour. Vous pouvez la maintenir jusqu’à 10 minutes."
    },
    {
      "id": "rage-dragon-2024.dragon.flight",
      "en": "When you reach character level 5, you can channel draconic magic to give yourself temporary flight. As a Bonus Action, you sprout spectral wings on your back that last for 10 minutes or until you retract the wings (no action required) or have the Incapacitated condition. During that time, you have a Fly Speed equal to your Speed. Your wings appear to be made of the same energy as your Breath Weapon. Once you use this trait, you can’t use it again until you finish a Long Rest.",
      "fr": "À partir du niveau 5 de personnage, vous pouvez canaliser la magie draconique pour voler temporairement. Par une action Bonus, des ailes spectrales apparaissent dans votre dos pendant 10 minutes, jusqu’à ce que vous les rétractiez sans action, ou jusqu’à ce que vous subissiez l’état Neutralisé. Pendant cette durée, votre Vitesse de vol est égale à votre Vitesse. Vos ailes semblent constituées de la même énergie que votre Souffle. Après avoir utilisé ce trait, vous devez terminer un Repos long avant de pouvoir l’utiliser de nouveau."
    },
    {
      "id": "rage-dragon-2024.dragon.breath",
      "en": "When you take the Attack action on your turn, you can replace one of your attacks with an exhalation of magical energy in either a 15-foot Cone or a 30-foot Line that is 5 feet wide (choose the shape each time). Each creature in that area must make a Dexterity saving throw (DC 8 plus your Constitution modifier and Proficiency Bonus). On a failed save, a creature takes 1d10 damage of the type determined by your Draconic Ancestry trait. On a successful save, a creature takes half as much damage. This damage increases by 1d10 when you reach character levels 5 (2d10), 11 (3d10), and 17 (4d10).",
      "fr": "Lorsque vous entreprenez l’action Attaquer à votre tour, vous pouvez remplacer l’une de vos attaques par un souffle d’énergie magique dans un Cône de 15 feet ou une Ligne de 30 feet et de 5 feet de large, au choix à chaque utilisation. Chaque créature dans la zone doit effectuer un jet de sauvegarde de Dextérité dont le DD est égal à 8 + votre modificateur de Constitution + votre bonus de maîtrise. En cas d’échec, elle subit 1d10 dégâts du type déterminé par votre Ascendance draconique. En cas de réussite, elle subit la moitié de ces dégâts. Les dégâts augmentent de 1d10 aux niveaux de personnage 5 (2d10), 11 (3d10) et 17 (4d10)."
    },
    {
      "id": "rage-dragon-2024.dragon.breath-uses",
      "en": "You can use this Breath Weapon a number of times equal to your Proficiency Bonus, and you regain all expended uses when you finish a Long Rest.",
      "fr": "Vous pouvez utiliser ce Souffle un nombre de fois égal à votre bonus de maîtrise et récupérez toutes les utilisations dépensées à la fin d’un Repos long."
    },
    {
      "id": "rage-dragon-2024.dragon.resistance",
      "en": "You have Resistance to the damage type determined by your Draconic Ancestry trait.",
      "fr": "Vous bénéficiez de la Résistance au type de dégâts déterminé par votre Ascendance draconique."
    }
  ]
}
