{
  "$schema": "../../../docs/translation-pack.schema.json",
  "schemaVersion": 1,
  "edition": "any",
  "source": "Sources détaillées par entrée",
  "entries": [
    {
      "id": "feat.catalogue.alert.0",
      "en": "Always on the lookout for danger, you gain the following benefits:",
      "fr": "Toujours à l’affût du danger, vous bénéficiez des avantages suivants :",
      "edition": "2014",
      "source": "Traduction proposée du texte anglais · Source.  Shard Player's Guide Volume 1 · relevé du 13 octobre 2026"
    },
    {
      "id": "feat.catalogue.alert.1",
      "en": "You gain a +5 bonus to initiative.",
      "fr": "Vous gagnez un bonus de +5 à l’Initiative.",
      "edition": "2014",
      "source": "Traduction proposée du texte anglais · Source.  Shard Player's Guide Volume 1 · relevé du 13 octobre 2026"
    },
    {
      "id": "feat.catalogue.alert.2",
      "en": "You can't be surprised while you are conscious.",
      "fr": "Vous ne pouvez pas être surpris tant que vous êtes conscient.",
      "edition": "2014",
      "source": "Traduction proposée du texte anglais · Source.  Shard Player's Guide Volume 1 · relevé du 13 octobre 2026"
    },
    {
      "id": "feat.catalogue.alert.3",
      "en": "Other creatures don't gain advantage on attack rolls against you as a result of being unseen by you.",
      "fr": "Les autres créatures ne bénéficient pas de l’Avantage aux jets d’attaque contre vous du seul fait que vous ne les voyez pas.",
      "edition": "2014",
      "source": "Traduction proposée du texte anglais · Source.  Shard Player's Guide Volume 1 · relevé du 13 octobre 2026"
    }
  ]
}
