{
  "$schema": "../../../docs/translation-pack.schema.json",
  "schemaVersion": 1,
  "edition": "any",
  "source": "Sources détaillées par entrée",
  "entries": [
    {
      "id": "narrative.species.dragonborn.any.1",
      "en": "The humanoid descendants of dragons have scaly hide, tails, draconic facial features and coloration, as well as breath weapons. They tend to be both strong and charismatic.",
      "edition": "any",
      "fr": "Ces descendants humanoïdes des dragons ont une peau écailleuse, une queue, des traits et des couleurs draconiques, ainsi qu’un souffle. Ils sont généralement à la fois forts et charismatiques.",
      "source": "Traduction proposée des descriptions visibles de Shard · Shard Player's Guide Volume 1 · relevé du 13 octobre 2026 · https://play.shardtabletop.com/"
    },
    {
      "id": "narrative.species.dwarf.any.1",
      "en": "Stocky and stalwart with a strong sense of fair play, dwarves live to an average age of 350 and generally have a hardy constitution.",
      "edition": "any",
      "fr": "Trapus et tenaces, avec un sens aigu de l’équité, les nains vivent en moyenne 350 ans et ont généralement une constitution robuste.",
      "source": "Traduction proposée des descriptions visibles de Shard · Shard Player's Guide Volume 1 · relevé du 13 octobre 2026 · https://play.shardtabletop.com/"
    },
    {
      "id": "narrative.species.elf.any.1",
      "en": "Lithe and somewhat ethereal in outlook due to their exceptionally long lives, elves typically love freedom, variety, and self-expression.",
      "edition": "any",
      "fr": "Élancés et dotés d’une vision du monde quelque peu éthérée en raison de leur exceptionnelle longévité, les elfes aiment généralement la liberté, la diversité et l’expression personnelle.",
      "source": "Traduction proposée des descriptions visibles de Shard · Shard Player's Guide Volume 1 · relevé du 13 octobre 2026 · https://play.shardtabletop.com/"
    },
    {
      "id": "narrative.species.gnome.any.1",
      "en": "Small and highly intelligent, gnomes can be found in a variety of settings and professions; be they inventors, scholars, hopeless tinkers, jewelers or wanderers. Adventuring types tend towards wizardry and sleight of hand rather than brute force.",
      "edition": "any",
      "fr": "Petits et très intelligents, les gnomes se rencontrent dans toutes sortes de milieux et de métiers : inventeurs, érudits, bricoleurs impénitents, joailliers ou voyageurs. Ceux qui partent à l’aventure préfèrent généralement la magie et l’adresse à la force brute.",
      "source": "Traduction proposée des descriptions visibles de Shard · Shard Player's Guide Volume 1 · relevé du 13 octobre 2026 · https://play.shardtabletop.com/"
    },
    {
      "id": "narrative.species.half-elf.any.1",
      "en": "The descendants of mixed human and elven bloodlines tend to be highly charismatic and versatile. They tend to live roughly twice the average lifespan of a human and have adventurous spirits.",
      "edition": "any",
      "fr": "Les descendants de lignées humaines et elfiques mêlées sont généralement très charismatiques et polyvalents. Ils vivent souvent environ deux fois plus longtemps qu’un humain et ont l’esprit aventureux.",
      "source": "Traduction proposée des descriptions visibles de Shard · Shard Player's Guide Volume 1 · relevé du 13 octobre 2026 · https://play.shardtabletop.com/"
    },
    {
      "id": "narrative.species.half-orc.any.1",
      "en": "The descendants of human and orc bloodlines can be relentless and savage, but much depends on their upbringing.",
      "edition": "any",
      "fr": "Les descendants de lignées humaines et orques peuvent se montrer acharnés et farouches, mais leur éducation joue un rôle déterminant.",
      "source": "Traduction proposée des descriptions visibles de Shard · Shard Player's Guide Volume 1 · relevé du 13 octobre 2026 · https://play.shardtabletop.com/"
    },
    {
      "id": "narrative.species.halfling.any.1",
      "en": "Small in stature, halflings tend to be brave, lucky, and nimble. Most don't go out of their way to find trouble and stick to their hearth and home. Those few that seek out adventure make fine companions.",
      "edition": "any",
      "fr": "Petits par la taille, les halfelins sont généralement braves, chanceux et agiles. La plupart évitent de chercher les ennuis et préfèrent leur foyer. Les rares qui partent à l’aventure deviennent d’excellents compagnons.",
      "source": "Traduction proposée des descriptions visibles de Shard · Shard Player's Guide Volume 1 · relevé du 13 octobre 2026 · https://play.shardtabletop.com/"
    },
    {
      "id": "narrative.species.human.any.1",
      "en": "Highly adaptable to almost any environments, humans cannot be easily classified and have a wide variety of societal and cultural norms. Humans a capable of incredible good and hideous evil.",
      "edition": "any",
      "fr": "Capables de s’adapter à presque tous les environnements, les humains échappent aux classifications simples et présentent une grande diversité de normes sociales et culturelles. Ils peuvent accomplir un bien extraordinaire comme se livrer aux pires atrocités.",
      "source": "Traduction proposée des descriptions visibles de Shard · Shard Player's Guide Volume 1 · relevé du 13 octobre 2026 · https://play.shardtabletop.com/"
    },
    {
      "id": "narrative.species.tiefling.any.1",
      "en": "The blood of a fiend runs in every Tiefling's veins. While not innately evil, many end up there.",
      "edition": "any",
      "fr": "Le sang d’un fiélon coule dans les veines de chaque tieffelin. Sans être maléfiques par nature, beaucoup finissent par le devenir.",
      "source": "Traduction proposée des descriptions visibles de Shard · Shard Player's Guide Volume 1 · relevé du 13 octobre 2026 · https://play.shardtabletop.com/"
    },
    {
      "id": "narrative.subspecies.cavern-dwarf.any.1",
      "en": "Cavern dwarves delve deep under the earth and make their homes in mountainous regions rich in iron and precious metals.",
      "edition": "any",
      "fr": "Les nains des cavernes s’enfoncent profondément sous terre et établissent leurs demeures dans des régions montagneuses riches en fer et en métaux précieux.",
      "source": "Traduction proposée des descriptions visibles de Shard · Shard Player's Guide Volume 1 · relevé du 13 octobre 2026 · https://play.shardtabletop.com/"
    },
    {
      "id": "narrative.subspecies.green-halfling.any.1",
      "en": "As a Green halfling, you are very aware of the natural world and your thoughtful contemplation has made you wiser than average. Green Halfings are cautious folk. Slow to trust, but steadfast allies once they do.",
      "edition": "any",
      "fr": "En tant que halfelin vert, vous êtes très attentif à la nature et votre réflexion posée vous a rendu plus sage que la moyenne. Les halfelins verts sont prudents : ils accordent lentement leur confiance, mais deviennent ensuite des alliés fidèles.",
      "source": "Traduction proposée des descriptions visibles de Shard · Shard Player's Guide Volume 1 · relevé du 13 octobre 2026 · https://play.shardtabletop.com/"
    },
    {
      "id": "narrative.subspecies.hill-dwarf.any.1",
      "en": "As a hill dwarf, you have keen senses, deep intuition, and remarkable resilience.",
      "edition": "any",
      "fr": "En tant que nain des collines, vous possédez des sens aiguisés, une intuition profonde et une résistance remarquable.",
      "source": "Traduction proposée des descriptions visibles de Shard · Shard Player's Guide Volume 1 · relevé du 13 octobre 2026 · https://play.shardtabletop.com/"
    },
    {
      "id": "narrative.subspecies.sylvan-gnome.any.1",
      "en": "Slyvan gnomes are sly and quick, difficult to spot and harder to catch. They live in the forests of world and delight in tricks of all kinds.",
      "edition": "any",
      "fr": "Les gnomes sylvestres sont rusés et rapides, difficiles à repérer et plus encore à attraper. Ils vivent dans les forêts du monde et se délectent de toutes sortes de tours.",
      "source": "Traduction proposée des descriptions visibles de Shard · Shard Player's Guide Volume 1 · relevé du 13 octobre 2026 · https://play.shardtabletop.com/"
    },
    {
      "id": "narrative.subspecies.woodland-elf.any.1",
      "en": "Woodland elves roam the high forests in small family groups. The tend to be reclusive and nomadic, but sometimes form permanent communities. Their sacred places nest high among the trees in old growth forests.",
      "edition": "any",
      "fr": "Les elfes sylvestres parcourent les hautes forêts en petits groupes familiaux. Ils sont généralement reclus et nomades, mais fondent parfois des communautés permanentes. Leurs lieux sacrés sont nichés au sommet des arbres des forêts anciennes.",
      "source": "Traduction proposée des descriptions visibles de Shard · Shard Player's Guide Volume 1 · relevé du 13 octobre 2026 · https://play.shardtabletop.com/"
    }
  ]
}
