{
  "$schema": "../docs/translation-pack.schema.json",
  "schemaVersion": 1,
  "edition": "2014",
  "source": "Traduction de l’extrait utilisateur et des passages SRD correspondants · adaptation française · CC-BY-4.0 · https://www.dndbeyond.com/srd",
  "entries": [
    {
      "id": "proprietes-armes-2014.heavy",
      "en": "Small creatures have disadvantage on attack rolls with heavy weapons. A heavy weapon's size and bulk make it too large for a Small creature to use effectively.",
      "fr": "Les créatures de taille Petite subissent le désavantage aux jets d’attaque avec des armes lourdes. La taille et l’encombrement d’une arme lourde empêchent une créature de taille Petite de l’utiliser efficacement."
    },
    {
      "id": "proprietes-armes-2014.two-handed",
      "en": "This weapon requires two hands to use. This property is relevant only when you attack with the weapon, not when you simply hold it.",
      "fr": "Cette arme nécessite deux mains pour être utilisée. Cette propriété s’applique uniquement lorsque vous attaquez avec l’arme, pas lorsque vous la tenez simplement."
    },
    {
      "id": "proprietes-armes-2014.light",
      "en": "A light weapon is small and easy to handle, making it ideal for use when fighting with two weapons.",
      "fr": "Une arme légère est petite et facile à manier, ce qui la rend idéale pour combattre avec deux armes."
    },
    {
      "id": "proprietes-armes-2014.thrown",
      "en": "If a weapon has the thrown property, you can throw the weapon to make a ranged attack. If the weapon is a melee weapon, you use the same ability modifier for that attack roll and damage roll that you would use for a melee attack with the weapon. For example, if you throw a handaxe, you use your Strength, but if you throw a dagger, you can use either your Strength or your Dexterity, since the dagger has the finesse property.",
      "fr": "Si une arme possède la propriété Lancer, vous pouvez la lancer pour effectuer une attaque à distance. S’il s’agit d’une arme de corps à corps, vous utilisez le même modificateur de caractéristique pour les jets d’attaque et de dégâts que pour une attaque de corps à corps avec cette arme. Par exemple, lancer une hachette utilise la Force, tandis que lancer une dague permet d’utiliser la Force ou la Dextérité grâce à sa propriété Finesse."
    },
    {
      "id": "proprietes-armes-2014.finesse",
      "en": "When making an attack with a finesse weapon, you use your choice of your Strength or Dexterity modifier for the attack and damage rolls. You must use the same modifier for both rolls.",
      "fr": "Lorsque vous attaquez avec une arme dotée de la propriété Finesse, vous choisissez votre modificateur de Force ou de Dextérité pour les jets d’attaque et de dégâts. Vous devez utiliser le même modificateur pour les deux jets."
    },
    {
      "id": "proprietes-armes-2014.reach",
      "en": "This weapon adds 5 feet to your reach when you attack with it, as well as when determining your reach for opportunity attacks with it.",
      "fr": "Cette arme ajoute 5 feet à votre allonge lorsque vous attaquez avec elle et lorsque vous déterminez votre allonge pour les attaques d’opportunité effectuées avec elle."
    },
    {
      "id": "proprietes-armes-2014.loading",
      "en": "Because of the time required to load this weapon, you can fire only one piece of ammunition from it when you use an action, bonus action, or reaction to fire it, regardless of the number of attacks you can normally make.",
      "fr": "En raison du temps nécessaire pour charger cette arme, vous ne pouvez tirer qu’une seule munition avec elle lorsque vous utilisez une action, une action Bonus ou une réaction pour tirer, quel que soit le nombre d’attaques que vous pouvez normalement effectuer."
    },
    {
      "id": "proprietes-armes-2014.versatile",
      "en": "This weapon can be used with one or two hands. A damage value in parentheses appears with the property—the damage when the weapon is used with two hands to make a melee attack.",
      "fr": "Cette arme peut être utilisée à une ou deux mains. La valeur de dégâts entre parenthèses indique les dégâts infligés lorsqu’elle est utilisée à deux mains pour effectuer une attaque de corps à corps."
    }
  ]
}
