{
  "$schema": "../docs/translation-pack.schema.json",
  "schemaVersion": 1,
  "edition": "2014",
  "source": "Traduction proposée de passages SRD 5.1 EN · référence AideDD https://www.aidedd.org/dnd/sorts.php?vo=prestidigitation · CC-BY-4.0 pour les passages SRD",
  "entries": [
    {
      "id": "prestidigitation-2014.creation",
      "en": "You create a nonmagical trinket or an illusory image that can fit in your hand and that lasts until the end of your next turn.",
      "fr": "Vous créez une babiole non magique ou une image illusoire qui tient dans votre main et persiste jusqu’à la fin de votre prochain tour."
    },
    {
      "id": "prestidigitation-2014.multiple",
      "en": "If you cast this spell multiple times, you can have up to three of its non-instantaneous effects active at a time, and you can dismiss such an effect as an action.",
      "fr": "Si vous lancez ce sort plusieurs fois, vous pouvez maintenir jusqu’à trois de ses effets non instantanés à la fois et mettre fin à l’un d’eux par une action."
    }
  ]
}
