{
  "$schema": "../docs/translation-pack.schema.json",
  "schemaVersion": 1,
  "edition": "2024",
  "source": "Traduction de passages du SRD 5.2.1 EN · adaptation française · CC-BY-4.0 · https://www.dndbeyond.com/srd",
  "entries": [
    {
      "id": "elf.fey-ancestry",
      "en": "You have Advantage on saving throws you make to avoid or end the Charmed condition.",
      "fr": "Vous avez l’Avantage aux jets de sauvegarde visant à éviter l’état Charmé ou à y mettre fin."
    },
    {
      "id": "elf.keen-senses",
      "en": "You have proficiency in the Insight, Perception, or Survival skill.",
      "fr": "Vous gagnez la maîtrise d’Intuition, de Perception ou de Survie."
    },
    {
      "id": "elf.trance",
      "en": "You don’t need to sleep, and magic can’t put you to sleep. You can finish a Long Rest in 4 hours if you spend those hours in a trancelike meditation, during which you retain consciousness.",
      "fr": "Vous n’avez pas besoin de dormir et la magie ne peut pas vous endormir. Vous pouvez terminer un Repos long en 4 heures si vous les consacrez à une méditation semblable à une transe, pendant laquelle vous restez conscient."
    },
    {
      "id": "gnome.cunning",
      "en": "You have Advantage on Intelligence, Wisdom, and Charisma saving throws.",
      "fr": "Vous avez l’Avantage aux jets de sauvegarde d’Intelligence, de Sagesse et de Charisme."
    },
    {
      "id": "halfling.brave",
      "en": "You have Advantage on saving throws you make to avoid or end the Frightened condition.",
      "fr": "Vous avez l’Avantage aux jets de sauvegarde visant à éviter l’état Effrayé ou à y mettre fin."
    },
    {
      "id": "halfling.nimble",
      "en": "You can move through the space of any creature that is a size larger than you, but you can’t stop in the same space.",
      "fr": "Vous pouvez traverser l’espace d’une créature dont la catégorie de taille est supérieure à la vôtre, mais vous ne pouvez pas vous y arrêter."
    },
    {
      "id": "halfling.luck",
      "en": "When you roll a 1 on the d20 of a D20 Test, you can reroll the die, and you must use the new roll.",
      "fr": "Lorsque vous obtenez un 1 sur le d20 d’un Test de d20, vous pouvez relancer le dé et devez utiliser le nouveau résultat."
    },
    {
      "id": "halfling.stealth",
      "en": "You can take the Hide action even when you are obscured only by a creature that is at least one size larger than you.",
      "fr": "Vous pouvez entreprendre l’action Se cacher même si vous n’êtes dissimulé que par une créature dont la catégorie de taille est supérieure à la vôtre."
    },
    {
      "id": "human.resourceful",
      "en": "You gain Heroic Inspiration whenever you finish a Long Rest.",
      "fr": "Vous gagnez l’Inspiration héroïque à la fin de chaque Repos long."
    },
    {
      "id": "human.skillful",
      "en": "You gain proficiency in one skill of your choice.",
      "fr": "Vous gagnez la maîtrise d’une compétence de votre choix."
    },
    {
      "id": "human.versatile",
      "en": "You gain an Origin feat of your choice (see “Feats”). Skilled is recommended.",
      "fr": "Vous gagnez un don d’origine de votre choix (voir « Dons »). Doué est recommandé."
    }
  ]
}
