{
  "$schema": "../docs/translation-pack.schema.json",
  "schemaVersion": 1,
  "edition": "2024",
  "source": "Traduction de l’extrait utilisateur et des passages SRD correspondants · adaptation française · CC-BY-4.0 · https://www.dndbeyond.com/srd",
  "entries": [
    {
      "id": "proprietes-armes-2024.proficiency",
      "en": "Anyone can wield a weapon, but you must have proficiency with it to add your Proficiency Bonus to an attack roll you make with it. A player character’s features can provide weapon proficiencies. A monster is proficient with any weapon in its stat block.",
      "fr": "Tout le monde peut manier une arme, mais vous devez en avoir la maîtrise pour ajouter votre bonus de maîtrise aux jets d’attaque effectués avec elle. Les aptitudes d’un personnage peuvent accorder des maîtrises d’armes. Un monstre maîtrise toutes les armes figurant dans son profil."
    },
    {
      "id": "proprietes-armes-2024.ammunition",
      "en": "You can use a weapon that has the Ammunition property to make a ranged attack only if you have ammunition to fire from it. The type of ammunition required is specified with the weapon’s range. Each attack expends one piece of ammunition. Drawing the ammunition is part of the attack (you need a free hand to load a one-handed weapon). After a fight, you can spend 1 minute to recover half the ammunition (round down) you used in the fight; the rest is lost.",
      "fr": "Vous ne pouvez effectuer une attaque à distance avec une arme dotée de la propriété Munitions que si vous disposez des munitions nécessaires, dont le type est indiqué avec la portée de l’arme. Chaque attaque dépense une munition. Sortir la munition fait partie de l’attaque ; charger une arme à une main nécessite une main libre. Après un combat, vous pouvez consacrer 1 minute à récupérer la moitié des munitions utilisées, arrondie à l’entier inférieur. Le reste est perdu."
    },
    {
      "id": "proprietes-armes-2024.finesse",
      "en": "When making an attack with a Finesse weapon, use your choice of your Strength or Dexterity modifier for the attack and damage rolls. You must use the same modifier for both rolls.",
      "fr": "Lorsque vous attaquez avec une arme dotée de la propriété Finesse, choisissez votre modificateur de Force ou de Dextérité pour les jets d’attaque et de dégâts. Vous devez utiliser le même modificateur pour les deux jets."
    },
    {
      "id": "proprietes-armes-2024.heavy",
      "en": "You have Disadvantage on attack rolls with a Heavy weapon if it’s a Melee weapon and your Strength score isn’t at least 13 or if it’s a Ranged weapon and your Dexterity score isn’t at least 13.",
      "fr": "Vous subissez le Désavantage aux jets d’attaque avec une arme Lourde s’il s’agit d’une arme de corps à corps et que votre Force est inférieure à 13, ou d’une arme à distance et que votre Dextérité est inférieure à 13."
    },
    {
      "id": "proprietes-armes-2024.light",
      "en": "When you take the Attack action on your turn and attack with a Light weapon, you can make one extra attack as a Bonus Action later on the same turn. That extra attack must be made with a different Light weapon, and you don’t add your ability modifier to the extra attack’s damage unless that modifier is negative. For example, you can attack with a Shortsword in one hand and a Dagger in the other using the Attack action and a Bonus Action, but you don’t add your Strength or Dexterity modifier to the damage roll of the Bonus Action unless that modifier is negative.",
      "fr": "Lorsque vous entreprenez l’action Attaquer à votre tour et attaquez avec une arme Légère, vous pouvez effectuer une attaque supplémentaire par une action Bonus plus tard dans ce même tour. Elle doit utiliser une autre arme Légère, et vous n’ajoutez pas votre modificateur de caractéristique à ses dégâts, sauf s’il est négatif. Par exemple, vous pouvez attaquer avec une épée courte dans une main et une dague dans l’autre en utilisant l’action Attaquer et une action Bonus, mais vous n’ajoutez pas votre modificateur de Force ou de Dextérité aux dégâts de l’attaque de l’action Bonus, sauf s’il est négatif."
    },
    {
      "id": "proprietes-armes-2024.loading",
      "en": "You can fire only one piece of ammunition from a Loading weapon when you use an action, a Bonus Action, or a Reaction to fire it, regardless of the number of attacks you can normally make.",
      "fr": "Lorsque vous utilisez une action, une action Bonus ou une Réaction pour tirer avec une arme dotée de la propriété Chargement, vous ne pouvez tirer qu’une seule munition, quel que soit le nombre d’attaques que vous pouvez normalement effectuer."
    },
    {
      "id": "proprietes-armes-2024.range",
      "en": "A Range weapon has a range in parentheses after the Ammunition or Thrown property. The range lists two numbers. The first is the weapon’s normal range in feet, and the second is the weapon’s long range. When attacking a target beyond normal range, you have Disadvantage on the attack roll. You can’t attack a target beyond the long range.",
      "fr": "La portée d’une arme figure entre parenthèses après la propriété Munitions ou Lancer, sous la forme de deux nombres. Le premier indique la portée normale en feet et le second la portée longue. Attaquer au-delà de la portée normale impose le Désavantage au jet d’attaque. Vous ne pouvez pas attaquer au-delà de la portée longue."
    },
    {
      "id": "proprietes-armes-2024.reach",
      "en": "A Reach weapon adds 5 feet to your reach when you attack with it, as well as when determining your reach for Opportunity Attacks with it.",
      "fr": "Une arme dotée de la propriété Allonge ajoute 5 feet à votre allonge lorsque vous attaquez avec elle et lorsque vous déterminez votre allonge pour ses attaques d’opportunité."
    },
    {
      "id": "proprietes-armes-2024.thrown",
      "en": "If a weapon has the Thrown property, you can throw the weapon to make a ranged attack, and you can draw that weapon as part of the attack. If the weapon is a Melee weapon, use the same ability modifier for the attack and damage rolls that you use for a melee attack with that weapon.",
      "fr": "Si une arme possède la propriété Lancer, vous pouvez la lancer pour effectuer une attaque à distance et la dégainer dans le cadre de cette attaque. S’il s’agit d’une arme de corps à corps, utilisez le même modificateur de caractéristique pour les jets d’attaque et de dégâts que pour une attaque de corps à corps avec cette arme."
    },
    {
      "id": "proprietes-armes-2024.two-handed",
      "en": "A Two-Handed weapon requires two hands when you attack with it.",
      "fr": "Une arme dotée de la propriété Deux mains nécessite deux mains lorsque vous attaquez avec elle."
    },
    {
      "id": "proprietes-armes-2024.versatile",
      "en": "A Versatile weapon can be used with one or two hands. A damage value in parentheses appears with the property. The weapon deals that damage when used with two hands to make a melee attack.",
      "fr": "Une arme Polyvalente peut être utilisée à une ou deux mains. La valeur de dégâts entre parenthèses indique les dégâts infligés lorsqu’elle est utilisée à deux mains pour effectuer une attaque de corps à corps."
    }
  ]
}
