{
  "$schema": "../docs/translation-pack.schema.json",
  "schemaVersion": 1,
  "edition": "2014",
  "source": "Traduction de l’extrait utilisateur et des passages SRD correspondants · adaptation française · CC-BY-4.0 · https://www.dndbeyond.com/srd",
  "entries": [
    {
      "id": "thaumaturgie-puces-2014.voice",
      "en": "Your voice booms up to three times as loud as normal for 1 minute.",
      "fr": "Votre voix retentit jusqu’à trois fois plus fort que la normale pendant 1 minute."
    },
    {
      "id": "thaumaturgie-puces-2014.flames",
      "en": "You cause flames to flicker, brighten, dim, or change color for 1 minute.",
      "fr": "Vous faites vaciller des flammes, augmentez ou atténuez leur intensité, ou changez leur couleur pendant 1 minute."
    },
    {
      "id": "thaumaturgie-puces-2014.tremors",
      "en": "You cause harmless tremors in the ground for 1 minute.",
      "fr": "Vous provoquez des secousses inoffensives dans le sol pendant 1 minute."
    },
    {
      "id": "thaumaturgie-puces-2014.sound",
      "en": "You create an instantaneous sound that originates from a point of your choice within range, such as a rumble of thunder, the cry of a raven, or ominous whispers.",
      "fr": "Vous produisez un son instantané provenant d’un point de votre choix à portée, comme un grondement de tonnerre, le cri d’un corbeau ou des murmures inquiétants."
    },
    {
      "id": "thaumaturgie-puces-2014.door",
      "en": "You instantaneously cause an unlocked door or window to fly open or slam shut.",
      "fr": "Vous faites instantanément s’ouvrir ou se fermer en claquant une porte ou une fenêtre non verrouillée."
    },
    {
      "id": "thaumaturgie-puces-2014.eyes",
      "en": "You alter the appearance of your eyes for 1 minute.",
      "fr": "Vous modifiez l’apparence de vos yeux pendant 1 minute."
    },
    {
      "id": "thaumaturgie-puces-2014.multiple",
      "en": "If you cast this spell multiple times, you can have up to three of its effects active at a time, and you can dismiss such an effect as an action.",
      "fr": "Si vous lancez ce sort plusieurs fois, vous pouvez maintenir jusqu’à trois de ses effets à la fois et mettre fin à l’un d’eux par une action."
    }
  ]
}
